{
  "pack_id": "technology_технология_продажи_снп_гарант_втб_розница_25_01_2024_5a268f4e2294d2c48a8af581d1e204ec77e1ad7cc51fae2ed90e92e8e2b698661802299407",
  "type": "technology",
  "name": "Технология продажи_СНП.Гарант_ВТБ_Розница_25.01.2024_5a268f4e2294d2c48a8af581d1e204ec77e1ad7cc51fae2ed90e92e8e2b698661802299407",
  "source_file": "AI-AGENT\\KNOWLEDGE\\SNPG\\Технология продажи_СНП.Гарант_ВТБ_Розница_25.01.2024_5a268f4e2294d2c48a8af581d1e204ec77e1ad7cc51fae2ed90e92e8e2b698661802299407.pdf",
  "source_filename": "Технология продажи_СНП.Гарант_ВТБ_Розница_25.01.2024_5a268f4e2294d2c48a8af581d1e204ec77e1ad7cc51fae2ed90e92e8e2b698661802299407.pdf",
  "version": 1,
  "created_at": "2026-02-15 08:10:56",
  "updated_at": "2026-02-15 08:10:56",
  "content": {
    "stages": [
      "Шаг 1. Мы определяем с вами комфортную сумму для ежегодного пополнения программы. Необходимо сделать 5 таких пополнений за период накоплений.",
      "Шаг 2. После того, как вы сделали взнос в программу, Страховая компания начисляет сумму в размере __% от вашего взноса.",
      "Шаг 3. В результате через 5 лет по окончании программы вы получаете всю сумму ваших взносов ___ ₽ + сумму гарантированных/ фиксированных начислений",
      "капитал комфортными шагами."
    ],
    "discovery_questions": [
      "об уникальной программе, которая позволит вам уже сейчас зафиксировать повышенную ставку на длительный срок. Договорились/Хорошо?",
      "А что если я предложу вам другой вариант размещения? Там больше доходность, а надежность даже выше. Если интересно, давайте посчитаем,",
      "доход в будущем - предлагаю оставить часть средств и зафиксировать повышенный доход на длительный срок, согласны?",
      "Вы уже знаете какая сумма и когда точно она вам понадобится?",
      "Если это произойдет не завтра, так может пусть ваши деньги принесут вам еще доход?",
      "И.О., если бы у вас сейчас был миллион – на что бы вы его потратили? (слушаем ответы клиента)",
      "А самое приятное, когда этот миллион именно ВАШ (а не банка, не близких и т.п.), согласны?",
      "Добрый день!  Меня зовут _.  скажите, пожалуйста, как я могу к вам обращаться?",
      "Сотрудник: И.О., вижу, что на данный момент у вас отсутствуют активы с фиксированным доходом и финансовой защитой. С чем это связано?",
      "Клиент: О каких активах идет речь?"
    ],
    "objection_handling_patterns": [
      "- И.О., если бы у вас сейчас был миллион – на что бы вы его потратили? (слушаем ответы клиента)",
      "Клиент: Я хочу__ (слушаем ответ клиента)",
      "Клиент: Мне мешает__ (слушаем ответ клиента)",
      "Клиент: Еще__ (слушаем ответ клиента)",
      "Клиент: Тем что__ (слушаем ответ клиента)",
      "Клиент: __ рублей (слушаем ответ клиента)",
      "(слушаем ответ клиента)",
      "возражение клиента и перейти",
      "И.О., обращаю внимание на то, что вы можете отказаться от программы досрочно. При этом денежные средства возвращаются не в полном объеме, а в соответствии",
      "с выкупными суммами, размер которых указан в  договоре. Размер гарантированной выкупной суммы на каждый год указан в соответствии с параметрами Договора",
      "с возражениями",
      "ЧАСТЫЕ ВОЗРАЖЕНИЯ КЛИЕНТОВ"
    ],
    "next_step_patterns": [
      "об уникальной программе, которая позволит вам уже сейчас зафиксировать повышенную ставку на длительный срок. Договорились/Хорошо?",
      "Программа работает следующим образом:",
      "Также, условиями договора, предоставляется возможность адресно передать денежные средства тому, кто для вас действительно дорог.",
      "не более 19 500 рублей в год, это позволяет увеличить совокупную доходность по программе. А бесплатный сервис даст возможность оформить",
      "суммы полученного дохода, а только с той части, которая превысила средний размер ключевой ставки за период действия договора.",
      "ОБЯЗАТЕЛЬНО ДО ОФОРМЛЕНИЯ ДОГОВОРА ПРОГОВОРИТЬ ВМЕСТЕ С КЛИЕНТОМ СЛЕДУЮЩУЮ ИНФОРМАЦИЮ:",
      "И.О., прежде чем перейти к оформлению договора, необходимо убедиться, что у вас не осталось вопросов по условиям продукта. Вот, что я имею ввиду:",
      "И.О., в рамках данной программы возврат всех уплаченных взносов + начисленный доход (начисления) вы получаете после окончания договора.",
      "И.О., ваш договор страхования жизни заключен на 5 лет и подразумевает внесение ежегодных взносов. Отсутствие последующих взносов в программу, начиная с 1 года,",
      "с выкупными суммами, размер которых указан в  договоре. Размер гарантированной выкупной суммы на каждый год указан в соответствии с параметрами Договора"
    ],
    "recommended_phrases": [
      "«ФРАЗЫ-МОСТИКИ»",
      "ПРИМЕР ДИАЛОГА С КЛИЕНТОМ 1/3",
      "ПРИМЕР ДИАЛОГА С КЛИЕНТОМ 2/3",
      "ПРИМЕР ДИАЛОГА С КЛИЕНТОМ 3/3",
      "предыдущего опыта, ситуация может быстро поменяться и ставки по вкладам снизятся, например, как в 2021 году – доход по депозиту в",
      "Предлагаю нам еще раз встретиться по данному вопросу, например, завтра в ___ часов. Будем рады вас видеть вместе с вашим ___"
    ],
    "raw_excerpt": "«Стратегия на пять.\nГарант»\nТехнология продажи\nЦЕЛЬ ВИЗИТА КЛИЕНТА – ДЕПОЗИТ\n«ФРАЗЫ-МОСТИКИ»\nИ.О., в настоящий момент в нашем банке есть различные предложения для размещения денежных средств. Давайте, я вам расскажу сначала\nоб уникальной программе, которая позволит вам уже сейчас зафиксировать повышенную ставку на длительный срок. Договорились/Хорошо?\nКЛИЕНТ ХОЧЕТ РАЗМЕСТИТЬ СОБСТВЕННЫЕ СВОБОДНЫЕ СРЕДСТВА\nА что если я предложу вам другой вариант размещения? Там больше доходность, а надежность даже выше. Если интересно, давайте посчитаем,\nкакие условия мы с вами можем получить.\nЗАКРЫВАЕТ ДЕПОЗИТ – НЕДОВОЛЕН СТАВКОЙ\nЗАКРЫВАЕТ ДЕПОЗИТ – В СВЯЗИ С КРУПНОЙ ПОКУПКОЙ\nИ.О., наверняка вы заметили, как быстро в последнее время меняются ставки по накопительным инструментам. Для того, чтобы не упускать выгоду/\nдоход в будущем - предлагаю оставить часть средств и зафиксировать повышенный доход на длительный срок, согласны?\nЗАКРЫВАЕТ ДЕПОЗИТ – В БЛИЖАЙШЕЕ ВРЕМЯ ПОНАДОБЯТСЯ ДЕНЬГИ\nВы уже знаете какая сумма и когда точно она вам понадобится?\nЕсли это произойдет не завтра, так может пусть ваши деньги принесут вам еще доход?\nВы можете распределить деньги так, чтобы и «под рукой» были и продолжали приносить вам повышенный доход. Если интересно, давайте я покажу,\nкак это можно сделать, а вы сами примите решение.\nПОЗИЦИОНИРОВАНИЕ ПРОГРАММЫ\n«СТРАТЕГИЯ НА ПЯТЬ. ГАРАНТ»\nВАРИАНТ 1 (ДЛЯ ПОВЫШЕНИЯ ЧЕКА ПО ПРОДУКТУ. ОБЯЗАТЕЛЬНО ИСПОЛЬЗУЕМ ONE-PAGE ДЛЯ ВИЗУАЛИЗАЦИИ)\n- И.О., если бы у вас сейчас был миллион – на что бы вы его потратили? (слушаем ответы клиента)\n- А самое приятное, когда этот миллион именно ВАШ (а не банка, не близких и т.п.), согласны?\n- И.О., самое сложное в том, чтобы его накопить – это начать делать это.\nИменно поэтому, мы предлагаем клиентам инструмент, который позволит сделать это уже сегодня - быстро, а главное- выгодно.\nДавайте расскажу подробнее, как это работает.\nВАРИАНТ 2 (УНИВЕРСАЛЬНЫЙ)\n- И.О., в последнее время ставки по накопительным инструментам меняются достаточно часто.\nПоэтому мы предлагаем нашим клиентам зафиксировать повышенный доход на длительный срок для всех будущих вложений в программу\nи получить дополнительные преимущества. Тем более, чтобы открыть программу вам нужно всего 20% капитала, а не вся сумма сразу.\n- Давайте расскажу подробнее об этом инструменте.\n«СТРАТЕГИЯ НА ПЯТЬ. ГАРАНТ»\nПРЕЗЕНТАЦИЯ ПРОГРАММЫ\nПРОГРАММА «СТРАТЕГИЯ НА ПЯТЬ. ГАРАНТ» - это уникальная программа, которая позволяет выгодно сформировать необходимый капитал и\nзафиксировать ставку на длительный срок.\nВы начинаете формировать свои накопления, которые позволят вам получить гарантированный/фиксированный доход выше, чем по вкладу\nза счет начислений от нашего партнера/ Страховой компании.\nПрограмма работает следующим образом:\nШаг 1. Мы определяем с вами комфортную сумму для ежегодного пополнения программы. Необходимо сделать 5 таких пополнений за период накоплений.\nШаг 2. После того, как вы сделали взнос в программу, Страховая компания начисляет сумму в размере __% от вашего взноса.\nШаг 3. В результате через 5 лет по окончании программы вы получаете всю сумму ваших взносов ___ ₽ + сумму гарантированных/ фиксированных начислений\nот Страховой компании ____ ₽.\nТаким образом, ваш доход по программе составит ____ ₽ или ____ % за весь период или ____ % годовых.\nДополнительно от государства вам ежегодно предоставляется возможность получения социального налогового вычета в размере 13%1 от каждого вашего взноса\nв программу (не более 19 500 ₽ в год1).\nВажным условием для получения таких преимущества являются обязательные взносы, именно они позволяют гарантированно сформировать определённый\nкапитал и получить доход выше, чем по депозиту.\n1 Ст. 210 НК РФ, ст. 219 НК РФ, ст. 224  НК РФ. При годовом доходе до 5 млн рублей – 13% (не более 19 500 рублей), при годовом доходе свыше 5 млн рублей –\n15% (не более 22 500 рублей).\nПРИМЕР ДИАЛОГА С КЛИЕНТОМ 1/3\n(«БЫСТРАЯ ПРОДАЖА»)\nДобрый день!  Меня зовут _.  скажите, пожалуйста, как я могу к вам обращаться?\nСотрудник: И.О., вижу, что на данный момент у вас отсутствуют активы с фиксированным доходом и финансовой защитой. С чем это связано?\nКлиент: О каких активах идет речь?\nСотрудник: Я говорю про инструменты, которые позволяют выгодно сформировать капитал и обеспечить сохранность ваших сбережений. И.О., делаете ли вы накопления?\nКлиент: Да, делаю\nКлиент: Нет. Не делаю\nСотрудник: Что вам мешает откладывать средства?\nСотрудник: Могу уточнить, для какой цели вы откладываете средства?\nКлиент: Я хочу__ (слушаем ответ клиента)\nКлиент: Мне мешает__ (слушаем ответ клиента)\nСотрудник: Действительно, это мешает сформировать необходимый капитал.\nНо важно помнить, что сбережения дают нам финансовую свободу\nи уверенность в завтрашнем дне. Если бы вам удалось накопить средства,\nна что бы вы их потратили?\nСотрудник: Сколько времени вам потребуется, чтобы собрать желаемую\nсумму?\nКлиент: Еще__ (слушаем ответ клиента)\nСотрудник: Как думаете, чем обусловлен такой срок?\nКлиент: Тем что__ (слушаем ответ клиента)\nСотрудник: Скажите, за последний месяц вам удалось что-нибудь отложить\nпосле расходов на текущие нужды?\nКлиент: Да, удалось\nКлиент: Нет, не удалось\nКлиент: Я хочу__ (слушаем ответ клиента)\nСотрудник: Отличное решение! Как думаете, какая сумма вам потребуется\nдля реализации этой цели?\nКлиент: __ рублей (слушаем ответ клиента)\nСотрудник: В нашем банке есть программа, которая позволит вам\nкомфортно, а главное выгодно накопить необходимую сумму для вашей цели.\nДавайте расскажу подробнее о преимуществах?\nКлиент: Да, согласен\nКлиент: Нет, не согласен\nПРИМЕР ДИАЛОГА С КЛИЕНТОМ 2/3\n(«БЫСТРАЯ ПРОДАЖА»)\nКлиент: Да, удалось\nКлиент: Нет, не удалось\nСотрудник: Прекрасно, что вам\nудалось это сделать. Но, такая\nвозможность бывает не всегда.\nЧасто непредвиденные расходы\nзаставляют нас обращаться\nк сбережениям. А это мешает\nнакопить желаемую сумму.\nЯ хочу предложить вам\nинструмент, который позволит\nсформировать капитал и\nгарантированно достичь вашей\nцели. Давайте расскажу\nподробнее?\nСотрудник: Как думаете,\nв чем причина?\nКлиент: Причина в том, что___\n(слушаем ответ клиента)\nСотрудник: Действительно, это\nмешает откладывать средства\nкаждый месяц. Поэтому, я хочу\nпредложить вам инструмент,\nкоторый уже сегодня позволит вам\nначать копить желаемую сумму\nи не зависеть от влияния других\nфакторов. Давайте расскажу\nподробнее?\nКлиент: Да, согласен\nКлиент: Да, согласен\nКлиент: Нет, не согласен\nСотрудник: Прекрасно! Тогда\nдавайте поговорим\nо возможностях нашего\nинструмента.\nСотрудник: Что вас останавливает\nна пути к цели?\nКлиент: Причина в том, что___\n(слушаем ответ клиента)\nСотрудник: (отработать\nвозражение клиента и перейти\nк презентации программы)\nПереходим к презентации программы на «языке выгод» и далее подбираем\nпараметры программы (взнос/ сумма накоплений)\nСотрудник: И.О., давайте посмотрим, как работает программа. Можете выбрать наиболее комфортный для себя подход к формированию сбережений.\nВы хотели бы накопить средства – быстрее или как можно больше?\nКлиент: Больше\nКлиент: Быстрее\nПРИМЕР ДИАЛОГА С КЛИЕНТОМ 3/3\n(«БЫСТРАЯ ПРОДАЖА»)\nСотрудник: Какую сумму вы хотели бы накопить?\n(зафиксируйте сумму желаемых накоплений клиента\nи рассчитайте ежегодный взнос с учетом начисляемого кешбэка)\nЧтобы накопить _руб., вам необходимо:\nСделать всего 5 взносов в размере _руб.\nНа каждый ваш взнос в программу вам будет начислен кешбэк\nв размере _% (_руб.)\nСумма ваших ежегодных накоплений с учетом кешбэка составит _руб,\nчто позволит вам гарантированно придти к своей финансовой цели\nв размере _руб. уже через 5 лет.\nДополнительно каждый год вам предоставляется возможность получения\nсоциального налогового вычета в размере 13% от каждого вашего взноса\nв программу (не более 19 500 ₽ в год).\nТаким образом, вы внесете всего _руб. в программу и ваша финансовая цель\nбудет достигнута быстрее за счет гарантированного дохода в программе.\nКлиент: Больше\nКлиент: Быстрее\nСотрудник: Какой размер ежегодного взноса для вас был бы комфортным?\n(зафиксируйте размер взноса клиента и рассчитайте итоговую сумму\nнакоплений без учета начисляемого кешбэка)\nЧтобы сформировать капитал больше, чем _руб., вам необходимо:\nСделать всего 5 взносов в размере _руб.\nНа каждый ваш взнос в программу вам будет начислен кешбэк\nв размере _% (_руб.)\nСумма ваших ежегодных накоплений с учетом кешбэка составит _руб,\nчто позволит вам гарантированно сформировать капитал в размере _руб.\n(сумма накоплений с кешбэком), вместо _руб. (сумма накоплений\nбез кешбэка).\nДополнительно каждый год вам предоставляется возможность получения\nсоциального налогового вычета в размере 13% от каждого вашего взноса\nв программу (не более 19 500 ₽ в год).\nТаким образом, ежегодная выгода пополнения программы с учетом кешбэка\nи СНВ составит - _% (доходность рассчитывается путем сложения размера\nкешбэка от СК _% и социального налогового вычета в размере 13% от взноса\nклиента, при условии, что ежегодный взнос в программу не превышает 150\n000 рублей). А по окончании программы вы сформируете капитал больше,\nчем запланировали.\nПРЕИМУЩЕСТВА ПРОГРАММЫ\nПРЕИМУЩЕСТВА\nПРЕЗЕНТАЦИЯ НА ЯЗЫКЕ ВЫГОД\nФиксированная/ Гарантированная\nдоходность\nПрограмма позволяет вам комфортно и выгодно сформировать необходимый капитал за счет повышенного фиксированных начислений от СК.\nСохранность\nкапитала\nПрограммой предусмотрена 100% защита вложенных средств.\nПрограмма позволит вам сформировать дисциплину накоплений и достичь своих финансовых целей с помощью гарантированной выплаты.\nЮридическая\nзащита\nСредства, которые находятся в программе, имеют режим конфиденциальности, не подлежат аресту, конфискации и разделу\nпри имущественных спорах.\nТакже, условиями договора, предоставляется возможность адресно передать денежные средства тому, кто для вас действительно дорог.\nЮридические преимущества позволяют защитить капитал от притязания со стороны третьих лиц и адресно передать средства, в случае\nнепредвиденных обстоятельств, без ожидания вступления в наследство.\nНалоговые\nльготы\nПо программе вам полагается гарантированный кешбэк от государства в размере 13% от суммы взноса (социальный налоговый вычет),\nне более 19 500 рублей в год, это позволяет увеличить совокупную доходность по программе. А бесплатный сервис даст возможность оформить\nдокументы и получить налог, не выходя из дома.\nНаверно, вы уже слышали, что с дохода по депозитам взымается налог в размере 13%, что снижает итоговую доходность по ним.\nВ отличие от депозита, к программе «Стратегия на пять. Гарант» применяется льготный режим налогообложения: налог 13% взымается не со всей\nсуммы полученного дохода, а только с той части, которая превысила средний размер ключевой ставки за период действия договора.\nИменно такой порядок налогообложения позволяет при одинаковых значениях доходности в инструментах получить дополнительную выгоду.\nФинансовая\nзащита близких\nВ случае непредвиденных событий, связанных с жизнью и здоровьем, близкие клиента гарантированно получат до 200% от суммы взносов.\nТакие привилегии для клиентов по нашему законодательству обеспечивает только полис страхования жизни, и ни один другой финансовый инструмент.\nИНФОРМАЦИЯ, КОТОРУЮ НЕОБХОДИМО ДОВЕСТИ\nДО СВЕДЕНИЯ КЛИЕНТА\nОБЯЗАТЕЛЬНО ДО ОФОРМЛЕНИЯ ДОГОВОРА ПРОГОВОРИТЬ ВМЕСТЕ С КЛИЕНТОМ СЛЕДУЮЩУЮ ИНФОРМАЦИЮ:\nИ.О., прежде чем перейти к оформлению договора, необходимо убедиться, что у вас не осталось вопросов по условиям продукта. Вот, что я имею ввиду:\nИ.О., обращаю ваше внимание на то, что данная программа не является банковским вкладом и оплаченные средства не подлежат страхованию в системе страхования\nвкладов. При этом, обязательства по выплате несет на себе Страховая Компания. По данной программе клиентам полагается социальный налоговый вычет, который\nсоставляет 13% от суммы уплаченного взноса, но не более 19 500 рублей1. Возможность получить такой вычет предусмотрена государством и является гарантированной.\nИ.О., в рамках данной программы возврат всех уплаченных взносов + начисленный доход (начисления) вы получаете после окончания договора.\nИ.О., ваш договор страхования жизни заключен на 5 лет и подразумевает внесение ежегодных взносов. Отсутствие последующих взносов в программу, начиная с 1 года,\nповлечет за собой финансовые потери, а именно не полный возврат внесенной ранее суммы.\nИ.О., обращаю внимание на то, что вы можете отказаться от программы досрочно. При этом денежные средства возвращаются не в полном объеме, а в соответствии\nс выкупными суммами, размер которых указан в  договоре. Размер гарантированной выкупной суммы на каждый год указан в соответствии с параметрами Договора\nи в первые два года действия договора страхования выкупная сумма = 0 (смотрим подробную информацию по порядку досрочного расторжения в пункте 12.2 Правил\nСтрахования). Также, хочу подчеркнуть, что при расторжении договора, страховая компания обязана, как налоговый агент, удержать НДФЛ за каждый год, когда уплачивался\nстраховой взнос, в случае не предоставления справки из ИФНС о не получении социального налогового вычета. Однако, полную сумму вложенных средств вы можете\nполучить по окончанию срока действия договора, а также в течение 30 календарных дней с момента заключения договора.\nИ.О., важно понимать, что выбранная вами программа страхования жизни предусматривает страховую защиту и страховые выплаты при наступлении неблагоприятных"
  }
}